{
  "contractVersion": "slot-browser-v1",
  "sessionId": "sid-demo-001",
  "requestCounter": 5,
  "currentStateVersion": 4,
  "bootstrapRef": {
    "id": "boot-ref-001"
  },
  "idempotencyKey": "feature-buy-5",
  "clientOperationId": "feature-buy-5",
  "selectedBet": {
    "coinValueMinor": 100,
    "lines": 20,
    "multiplier": 1,
    "totalBetMinor": 2000
  },
  "selectedFeatureChoice": {
    "featureType": "BUY_FEATURE",
    "action": "PURCHASE",
    "priceMinor": 5000,
    "payload": {
      "source": "hud"
    }
  }
}
